{
  "data_vault_model": [
    "${PROJECT_HOME}/models/ops-analytics/dv/ops_hub_hop_executions.hdv",
    "${PROJECT_HOME}/models/ops-analytics/dv/ops_hub_load_run.hdv",
    "${PROJECT_HOME}/models/ops-analytics/dv/ops_hub_model.hdv",
    "${PROJECT_HOME}/models/ops-analytics/dv/ops_hub_pipeline.hdv",
    "${PROJECT_HOME}/models/ops-analytics/dv/ops_hub_quality_run.hdv",
    "${PROJECT_HOME}/models/ops-analytics/dv/ops_hub_rule.hdv",
    "${PROJECT_HOME}/models/ops-analytics/dv/ops_hub_schema_harvest_run.hdv",
    "${PROJECT_HOME}/models/ops-analytics/dv/ops_hub_subject.hdv",
    "${PROJECT_HOME}/models/ops-analytics/dv/ops_hub_transform.hdv",
    "${PROJECT_HOME}/models/ops-analytics/dv/ops_hub_workflow_execution.hdv",
    "${PROJECT_HOME}/models/ops-analytics/dv/ops_hub_workflow_load_overview.hdv",
    "${PROJECT_HOME}/models/ops-analytics/dv/ops_lnk_load_insight.hdv",
    "${PROJECT_HOME}/models/ops-analytics/dv/ops_lnk_load_pipeline_metric.hdv",
    "${PROJECT_HOME}/models/ops-analytics/dv/ops_lnk_load_run_model.hdv",
    "${PROJECT_HOME}/models/ops-analytics/dv/ops_lnk_load_run_workflow_execution.hdv",
    "${PROJECT_HOME}/models/ops-analytics/dv/ops_lnk_load_transform_metric.hdv",
    "${PROJECT_HOME}/models/ops-analytics/dv/ops_lnk_quality_finding.hdv",
    "${PROJECT_HOME}/models/ops-analytics/dv/ops_lnk_quality_profile_field.hdv",
    "${PROJECT_HOME}/models/ops-analytics/dv/ops_lnk_quality_profile_subject.hdv",
    "${PROJECT_HOME}/models/ops-analytics/dv/ops_lnk_quality_run.hdv",
    "${PROJECT_HOME}/models/ops-analytics/dv/ops_lnk_schema_harvest_change.hdv",
    "${PROJECT_HOME}/models/ops-analytics/dv/ops_lnk_schema_harvest_field.hdv",
    "${PROJECT_HOME}/models/ops-analytics/dv/ops_lnk_schema_harvest_fk.hdv",
    "${PROJECT_HOME}/models/ops-analytics/dv/ops_lnk_schema_harvest_run.hdv",
    "${PROJECT_HOME}/models/ops-analytics/dv/ops_lnk_schema_harvest_subject.hdv",
    "${PROJECT_HOME}/models/ops-analytics/dv/ops_lnk_transform.hdv",
    "${PROJECT_HOME}/models/ops-analytics/dv/ops_lnk_workflow_load_overview.hdv",
    "${PROJECT_HOME}/models/ops-analytics/dv/ops_lnk_workflow_load_overview_model.hdv"
  ],
  "virtualPath": "",
  "detailedDataTypeChecking": true,
  "name": "ops-analytics",
  "previewRowLimit": 10,
  "description": "Operational analytics. Data Vault files are listed hubs and references before links.",
  "businessProcessCatalog": "ops-analytics",
  "business_vault_model": [
    "${PROJECT_HOME}/models/ops-analytics/ops-analytics.hbv"
  ],
  "dimensional_model": [
    "${PROJECT_HOME}/models/ops-analytics/dm/ops-analytics-dimensions.hdm",
    "${PROJECT_HOME}/models/ops-analytics/dm/ops-f-pipeline-load.hdm",
    "${PROJECT_HOME}/models/ops-analytics/dm/ops-f-transform-load.hdm",
    "${PROJECT_HOME}/models/ops-analytics/dm/ops-f-load-insight.hdm",
    "${PROJECT_HOME}/models/ops-analytics/dm/ops-f-workflow-overview.hdm",
    "${PROJECT_HOME}/models/ops-analytics/dm/ops-f-workflow-model.hdm",
    "${PROJECT_HOME}/models/ops-analytics/dm/ops-f-quality-run.hdm",
    "${PROJECT_HOME}/models/ops-analytics/dm/ops-f-quality-finding.hdm",
    "${PROJECT_HOME}/models/ops-analytics/dm/ops-f-quality-subject.hdm",
    "${PROJECT_HOME}/models/ops-analytics/dm/ops-f-quality-field.hdm",
    "${PROJECT_HOME}/models/ops-analytics/dm/ops-f-harvest-run.hdm",
    "${PROJECT_HOME}/models/ops-analytics/dm/ops-f-harvest-subject.hdm",
    "${PROJECT_HOME}/models/ops-analytics/dm/ops-f-harvest-change.hdm"
  ]
}